{
  "$schema": "./emberwatch_asset_brief.schema.json",
  "format": "aikami.asset-brief",
  "formatVersion": 1,
  "id": "emberwatch-5.0.0",
  "status": "proposed",
  "baseline": {
    "repository": "BearlySleeping/aikami",
    "commit": "60c010b85e7ed3df6e159d83dda50fd02f19948f",
    "packId": "emberwatch",
    "packVersion": "5.0.0",
    "reviewedAt": "2026-09-19"
  },
  "execution": {
    "defaultMode": "plan",
    "defaultPhase": "slice",
    "requiresRunnerContract": "C-519",
    "gpuConcurrency": 1,
    "candidateLimitPerItem": 2,
    "hostedBudgetUsd": 0,
    "autoAccept": false,
    "autoPublish": false,
    "unresolvedReferencePolicy": "block_required_inputs",
    "providerFallbackPolicy": "explicit_only"
  },
  "style": {
    "gridPixels": 32,
    "view": "orthogonal three-quarter overhead JRPG, not isometric",
    "palette": "muted moss and olive, weathered warm timber, cool slate, restrained amber accents",
    "lighting": "upper-left; no large baked ground shadow",
    "rules": [
      "real alpha for isolated props; opaque full coverage for terrain",
      "native 1x review before acceptance",
      "no independently stretched axes",
      "no generated text or checkerboard backgrounds",
      "preserve accepted originals and ground-contact origins",
      "LPC stays the production animation source",
      "declared canvas sizes are review targets, not mandatory distortion dimensions"
    ]
  },
  "audioDirection": {
    "motif": "original three-note ward motif; lock an accepted reference before expansion",
    "voices": "none",
    "mixTargets": "music -18 LUFS-I ±2; ambience -24 LUFS-I ±3; peak ≤-1 dBTP; short SFX category-calibrated",
    "loopReviewRepeats": 5,
    "note": "Targets are project choices. Requested duration/BPM/key are not measured facts. Ward ending stingers are deferred until authoritative story completion."
  },
  "preserve": {
    "mapIds": [
      "village",
      "inn",
      "merchant_shop",
      "old_road",
      "ruined_shrine"
    ],
    "npcIds": [
      "village_elder",
      "rollo_grasper",
      "merchant",
      "village_guard",
      "innkeeper_sella",
      "smith_orra",
      "cartographer_ivo",
      "shrine_keeper_nemi",
      "apprentice_tess",
      "woodcutter_ada"
    ],
    "questIds": [
      "fading_ward",
      "tools_for_tomorrow",
      "a_room_kept_warm",
      "mark_the_safe_trail"
    ],
    "mapExtents": {
      "village": [
        64,
        48
      ],
      "inn": [
        28,
        20
      ],
      "merchant_shop": [
        24,
        18
      ],
      "old_road": [
        72,
        36
      ],
      "ruined_shrine": [
        40,
        36
      ]
    },
    "invariants": [
      "stable prop/NPC/item/quest IDs and source identity mapping",
      "named spawns and reciprocal transitions",
      "32px movement grid and existing tactical terrain costs",
      "existing LPC appearance components/actions",
      "old installed pack locks and supported saves",
      "outdoor semantic terrain channel; indoor supported baked floor",
      "no new generator or network dependency for gameplay"
    ]
  },
  "reuseBeforeGenerate": [
    "accepted grass/earth/gravel/water sources",
    "oak, birch, inn, shop and shrine source art",
    "ward_large base and existing aligned variants if approved",
    "supplied well and furniture originals",
    "all ten NPC LPC animation compositions"
  ],
  "providerPreferences": {
    "local_image_reference": [
      "flux2_klein_base4b_comfy_profile",
      "existing_sdcpp_profile_if_required_capabilities_pass"
    ],
    "local_music": [
      "ace_step_15_2b_turbo_profile"
    ],
    "local_sfx": [
      "stable_audio_open_1_0_profile",
      "owned_or_appropriately_licensed_recording_import"
    ]
  },
  "experimentalProviders": [
    {
      "id": "mystic07_flux2_klein9b_spritesheet",
      "defaultEnabled": false,
      "requires": [
        "base/LoRA rights resolution",
        "exact compatible 9B model/workflow",
        "actual LPC action/direction/frame validation",
        "animated native-scale human review"
      ],
      "note": "Not a production prerequisite. Never run the 9B LoRA against 4B weights."
    },
    {
      "id": "pixellab_or_elevenlabs",
      "defaultEnabled": false,
      "requires": [
        "C-524",
        "configured credentials",
        "explicit positive spend ceiling",
        "intended-use rights evidence"
      ],
      "note": "No paid fallback from local jobs."
    }
  ],
  "preparationProfiles": {
    "prop-native-alpha": "source already carries a real alpha channel; crop/origin preserved, ground rectangle removed, no colour key",
    "prop-full-alpha-ground": "opaque render on a flat dark ground; alpha derived by luminance threshold and the ground plane detached by geometry",
    "portrait-original": "composed dialogue bust; keeps its own coverage and alpha, no ground-contact requirement",
    "lpc-sheet-native": "LPC sheets only; nearest-neighbour resample at the 13x21 cell grid"
  },
  "references": [
    {
      "id": "approved_style",
      "kind": "approved_art",
      "locator": "content/packs/emberwatch/props/ward_large.png",
      "resolution": "required",
      "sha256": null,
      "note": "The pack's own accepted ward-landmark art is the approved style reference. Resolved and hashed at plan time."
    },
    {
      "id": "ward_base",
      "kind": "existing_pack_art",
      "locator": "content/packs/emberwatch/props/ward_large.png",
      "resolution": "required",
      "sha256": null,
      "note": "The accepted ward landmark source. An aligned state edit must preserve its canvas, origin and silhouette exactly."
    },
    {
      "id": "appearance_village_elder",
      "kind": "npc_appearance",
      "locator": "content/packs/emberwatch/manifest.json#/npcs/village_elder",
      "resolution": "required",
      "sha256": null,
      "note": "Rendered reference for Elder Thalia; the stable LPC component ids stay unchanged, the portrait must match the named character."
    },
    {
      "id": "appearance_rollo_grasper",
      "kind": "npc_appearance",
      "locator": "content/packs/emberwatch/manifest.json#/npcs/rollo_grasper",
      "resolution": "required",
      "sha256": null,
      "note": "Rendered reference for Rollo the Grasper; the stable LPC component ids stay unchanged, the portrait must match the named character."
    },
    {
      "id": "appearance_merchant",
      "kind": "npc_appearance",
      "locator": "content/packs/emberwatch/manifest.json#/npcs/merchant",
      "resolution": "required",
      "sha256": null,
      "note": "Rendered reference for Mara the Merchant; the stable LPC component ids stay unchanged, the portrait must match the named character."
    },
    {
      "id": "appearance_village_guard",
      "kind": "npc_appearance",
      "locator": "content/packs/emberwatch/manifest.json#/npcs/village_guard",
      "resolution": "required",
      "sha256": null,
      "note": "Rendered reference for Bram the Guard; the stable LPC component ids stay unchanged, the portrait must match the named character."
    },
    {
      "id": "appearance_innkeeper_sella",
      "kind": "npc_appearance",
      "locator": "content/packs/emberwatch/manifest.json#/npcs/innkeeper_sella",
      "resolution": "required",
      "sha256": null,
      "note": "Rendered reference for Sella; the stable LPC component ids stay unchanged, the portrait must match the named character."
    },
    {
      "id": "appearance_smith_orra",
      "kind": "npc_appearance",
      "locator": "content/packs/emberwatch/manifest.json#/npcs/smith_orra",
      "resolution": "required",
      "sha256": null,
      "note": "Rendered reference for Orra; the stable LPC component ids stay unchanged, the portrait must match the named character."
    },
    {
      "id": "appearance_cartographer_ivo",
      "kind": "npc_appearance",
      "locator": "content/packs/emberwatch/manifest.json#/npcs/cartographer_ivo",
      "resolution": "required",
      "sha256": null,
      "note": "Rendered reference for Ivo; the stable LPC component ids stay unchanged, the portrait must match the named character."
    },
    {
      "id": "appearance_shrine_keeper_nemi",
      "kind": "npc_appearance",
      "locator": "content/packs/emberwatch/manifest.json#/npcs/shrine_keeper_nemi",
      "resolution": "required",
      "sha256": null,
      "note": "Rendered reference for Nemi; the stable LPC component ids stay unchanged, the portrait must match the named character."
    },
    {
      "id": "appearance_apprentice_tess",
      "kind": "npc_appearance",
      "locator": "content/packs/emberwatch/manifest.json#/npcs/apprentice_tess",
      "resolution": "required",
      "sha256": null,
      "note": "Rendered reference for Tess; the stable LPC component ids stay unchanged, the portrait must match the named character."
    },
    {
      "id": "appearance_woodcutter_ada",
      "kind": "npc_appearance",
      "locator": "content/packs/emberwatch/manifest.json#/npcs/woodcutter_ada",
      "resolution": "required",
      "sha256": null,
      "note": "Rendered reference for Ada; the stable LPC component ids stay unchanged, the portrait must match the named character."
    },
    {
      "id": "portrait_village_elder_neutral",
      "kind": "approved_art",
      "locator": "content/packs/emberwatch/portraits/village_elder/neutral.png",
      "resolution": "optional",
      "sha256": null,
      "note": "The accepted neutral portrait for this NPC. Optional at plan time (the emotion job can be planned before the neutral is installed) and required before the emotion variant is accepted."
    },
    {
      "id": "portrait_rollo_grasper_neutral",
      "kind": "approved_art",
      "locator": "content/packs/emberwatch/portraits/rollo_grasper/neutral.png",
      "resolution": "optional",
      "sha256": null,